[
  {
    "id": "rewards.sovereign-opening",
    "version": 1,
    "rollPolicy": "guaranteed",
    "entries": [
      {
        "id": "entry.sovereign.fragment",
        "rewardType": "material",
        "itemId": "material.ashen-jade-fragment",
        "quantityMin": 1,
        "quantityMax": 1,
        "chance": 1,
        "tradeable": true
      },
      {
        "id": "entry.sovereign.xp",
        "rewardType": "experience",
        "quantityMin": 100,
        "quantityMax": 100,
        "chance": 1,
        "tradeable": false
      }
    ]
  },
  {
    "id": "rewards.ashen-opening",
    "version": 1,
    "rollPolicy": "guaranteed",
    "entries": [
      {
        "id": "entry.ashen.fragment",
        "rewardType": "material",
        "itemId": "material.ashen-jade-fragment",
        "quantityMin": 1,
        "quantityMax": 2,
        "chance": 1,
        "tradeable": true
      },
      {
        "id": "entry.ashen.xp",
        "rewardType": "experience",
        "quantityMin": 100,
        "quantityMax": 100,
        "chance": 1,
        "tradeable": false
      }
    ]
  },
  {
    "id": "rewards.concord-opening",
    "version": 1,
    "rollPolicy": "guaranteed",
    "entries": [
      {
        "id": "entry.concord.fragment",
        "rewardType": "material",
        "itemId": "material.ashen-jade-fragment",
        "quantityMin": 1,
        "quantityMax": 1,
        "chance": 1,
        "tradeable": true
      },
      {
        "id": "entry.concord.xp",
        "rewardType": "experience",
        "quantityMin": 100,
        "quantityMax": 100,
        "chance": 1,
        "tradeable": false
      }
    ]
  },
  {
    "id": "rewards.ashen-frontier.rift-stalker",
    "version": 1,
    "rollPolicy": "personal_roll",
    "entries": [
      {
        "id": "entry.rift-stalker.xp",
        "rewardType": "experience",
        "quantityMin": 60,
        "quantityMax": 90,
        "chance": 1,
        "tradeable": false
      },
      {
        "id": "entry.rift-stalker.silver",
        "rewardType": "currency",
        "currencyCode": "SILVER",
        "quantityMin": 3,
        "quantityMax": 6,
        "chance": 1,
        "tradeable": false
      },
      {
        "id": "entry.rift-stalker.fragment",
        "rewardType": "material",
        "itemId": "material.ashen-jade-fragment",
        "quantityMin": 1,
        "quantityMax": 1,
        "chance": 0.08,
        "tradeable": true
      }
    ]
  },
  {
    "id": "rewards.ashen-frontier.ashen-wisp",
    "version": 1,
    "rollPolicy": "personal_roll",
    "entries": [
      {
        "id": "entry.ashen-wisp.xp",
        "rewardType": "experience",
        "quantityMin": 70,
        "quantityMax": 100,
        "chance": 1,
        "tradeable": false
      },
      {
        "id": "entry.ashen-wisp.silver",
        "rewardType": "currency",
        "currencyCode": "SILVER",
        "quantityMin": 3,
        "quantityMax": 7,
        "chance": 1,
        "tradeable": false
      },
      {
        "id": "entry.ashen-wisp.fragment",
        "rewardType": "material",
        "itemId": "material.ashen-jade-fragment",
        "quantityMin": 1,
        "quantityMax": 1,
        "chance": 0.1,
        "tradeable": true
      }
    ]
  },
  {
    "id": "rewards.ashen-frontier.jadebound-sentinel",
    "version": 1,
    "rollPolicy": "personal_roll",
    "entries": [
      {
        "id": "entry.jadebound-sentinel.xp",
        "rewardType": "experience",
        "quantityMin": 90,
        "quantityMax": 120,
        "chance": 1,
        "tradeable": false
      },
      {
        "id": "entry.jadebound-sentinel.silver",
        "rewardType": "currency",
        "currencyCode": "SILVER",
        "quantityMin": 5,
        "quantityMax": 9,
        "chance": 1,
        "tradeable": false
      },
      {
        "id": "entry.jadebound-sentinel.fragment",
        "rewardType": "material",
        "itemId": "material.ashen-jade-fragment",
        "quantityMin": 1,
        "quantityMax": 1,
        "chance": 0.12,
        "tradeable": true
      }
    ]
  },
  {
    "id": "rewards.elite.test-profile",
    "version": 1,
    "rollPolicy": "personal_roll",
    "entries": [
      {
        "id": "entry.elite.xp",
        "rewardType": "experience",
        "quantityMin": 250,
        "quantityMax": 500,
        "chance": 1,
        "tradeable": false
      },
      {
        "id": "entry.elite.silver",
        "rewardType": "currency",
        "currencyCode": "SILVER",
        "quantityMin": 15,
        "quantityMax": 30,
        "chance": 1,
        "tradeable": false
      },
      {
        "id": "entry.elite.common-material",
        "rewardType": "material",
        "itemId": "material.ashen-jade-fragment",
        "quantityMin": 1,
        "quantityMax": 1,
        "chance": 1,
        "tradeable": true
      },
      {
        "id": "entry.elite.uncommon-material",
        "rewardType": "material",
        "itemId": "material.ashen-jade-fragment",
        "quantityMin": 1,
        "quantityMax": 1,
        "chance": 0.15,
        "tradeable": true
      }
    ]
  },
  {
    "id": "rewards.dungeon-boss.test-profile",
    "version": 1,
    "rollPolicy": "bad_luck_protected",
    "entries": [
      {
        "id": "entry.dungeon-boss.xp",
        "rewardType": "experience",
        "quantityMin": 1500,
        "quantityMax": 4000,
        "chance": 1,
        "tradeable": false
      },
      {
        "id": "entry.dungeon-boss.silver",
        "rewardType": "currency",
        "currencyCode": "SILVER",
        "quantityMin": 50,
        "quantityMax": 120,
        "chance": 1,
        "tradeable": false
      },
      {
        "id": "entry.dungeon-boss.material",
        "rewardType": "material",
        "itemId": "material.ashen-jade-fragment",
        "quantityMin": 1,
        "quantityMax": 3,
        "chance": 1,
        "tradeable": true
      },
      {
        "id": "entry.dungeon-boss.rare",
        "rewardType": "item",
        "itemId": "consumable.spirit-tonic",
        "quantityMin": 1,
        "quantityMax": 1,
        "chance": 0.05,
        "tradeable": true,
        "badLuckGroupId": "bad-luck.dungeon-boss.rare"
      }
    ]
  },
  {
    "id": "rewards.sovereign.ward_that_lied",
    "version": 1,
    "rollPolicy": "guaranteed",
    "entries": [
      {
        "id": "entry.sovereign.ward-that-lied.xp",
        "rewardType": "experience",
        "quantityMin": 550,
        "quantityMax": 550,
        "chance": 1,
        "tradeable": false
      },
      {
        "id": "entry.sovereign.ward-that-lied.silver",
        "rewardType": "currency",
        "currencyCode": "SILVER",
        "quantityMin": 12,
        "quantityMax": 12,
        "chance": 1,
        "tradeable": false
      }
    ]
  },
  {
    "id": "rewards.ashen.shard_that_sang",
    "version": 1,
    "rollPolicy": "guaranteed",
    "entries": [
      {
        "id": "entry.ashen.shard-that-sang.xp",
        "rewardType": "experience",
        "quantityMin": 550,
        "quantityMax": 550,
        "chance": 1,
        "tradeable": false
      },
      {
        "id": "entry.ashen.shard-that-sang.silver",
        "rewardType": "currency",
        "currencyCode": "SILVER",
        "quantityMin": 12,
        "quantityMax": 12,
        "chance": 1,
        "tradeable": false
      }
    ]
  },
  {
    "id": "rewards.concord.forest_that_remembered",
    "version": 1,
    "rollPolicy": "guaranteed",
    "entries": [
      {
        "id": "entry.concord.forest-that-remembered.xp",
        "rewardType": "experience",
        "quantityMin": 550,
        "quantityMax": 550,
        "chance": 1,
        "tradeable": false
      },
      {
        "id": "entry.concord.forest-that-remembered.silver",
        "rewardType": "currency",
        "currencyCode": "SILVER",
        "quantityMin": 12,
        "quantityMax": 12,
        "chance": 1,
        "tradeable": false
      }
    ]
  },
  {
    "id": "rewards.sovereign.names_we_sealed",
    "version": 1,
    "rollPolicy": "guaranteed",
    "entries": [
      {
        "id": "entry.sovereign.names-we-sealed.xp",
        "rewardType": "experience",
        "quantityMin": 750,
        "quantityMax": 750,
        "chance": 1,
        "tradeable": false
      },
      {
        "id": "entry.sovereign.names-we-sealed.silver",
        "rewardType": "currency",
        "currencyCode": "SILVER",
        "quantityMin": 20,
        "quantityMax": 20,
        "chance": 1,
        "tradeable": false
      }
    ]
  },
  {
    "id": "rewards.sovereign.price_quiet_street",
    "version": 1,
    "rollPolicy": "guaranteed",
    "entries": [
      {
        "id": "entry.sovereign.price-quiet-street.xp",
        "rewardType": "experience",
        "quantityMin": 900,
        "quantityMax": 900,
        "chance": 1,
        "tradeable": false
      },
      {
        "id": "entry.sovereign.price-quiet-street.silver",
        "rewardType": "currency",
        "currencyCode": "SILVER",
        "quantityMin": 26,
        "quantityMax": 26,
        "chance": 1,
        "tradeable": false
      }
    ]
  },
  {
    "id": "rewards.sovereign.sword_unarmed",
    "version": 1,
    "rollPolicy": "guaranteed",
    "entries": [
      {
        "id": "entry.sovereign.sword-unarmed.xp",
        "rewardType": "experience",
        "quantityMin": 1100,
        "quantityMax": 1100,
        "chance": 1,
        "tradeable": false
      },
      {
        "id": "entry.sovereign.sword-unarmed.silver",
        "rewardType": "currency",
        "currencyCode": "SILVER",
        "quantityMin": 34,
        "quantityMax": 34,
        "chance": 1,
        "tradeable": false
      }
    ]
  },
  {
    "id": "rewards.sovereign.unsent_letters",
    "version": 1,
    "rollPolicy": "guaranteed",
    "entries": [
      {
        "id": "entry.sovereign.unsent-letters.xp",
        "rewardType": "experience",
        "quantityMin": 1300,
        "quantityMax": 1300,
        "chance": 1,